<?xml version="1.0" ?>

<!-- $Header: /nfs/slac/g/glast/ground/cvs/calibUtil/xml/test/gen2.xml,v 1.1 2002/12/05 17:37:26 jrb Exp $ -->

<!DOCTYPE calib SYSTEM "../genCalib.dtd" [] >

<calib>
  <header instrument="LAT" timestamp="2002-12-4-16:23"
          calType="Test_Gen" fmtVersion="1.0" locale="B108" >

    <inputSample startTime="2001-1-1-00:00" stopTime="2002-10-10-00:00"
                 triggers="random" mode="normal" source="made-up" >
       Don't need anything sensible here
    </inputSample>
  </header>

  <data name="fakeGen3" >
    <struct name="outerStruct">
      <leaf name="singleInt" dtype="int" value="14" />
      <struct name="innerStruct">
         <leaf name="floatArray" dtype="float" units="furlong"
               value="1.0 2.3  -13.2" />
         <leaf name="oneUnsigned" dtype="unsigned" value="33550336" />
      </struct>
    </struct>
  </data>
</calib>


